{
  "id": "rainbow-discrete",
  "kind": "sequential",
  "colors": [
    {
      "hex": "#E8ECFB"
    },
    {
      "hex": "#D9CCE3"
    },
    {
      "hex": "#D1BBD7"
    },
    {
      "hex": "#CAACCB"
    },
    {
      "hex": "#BA8DB4"
    },
    {
      "hex": "#AE76A3"
    },
    {
      "hex": "#AA6F9E"
    },
    {
      "hex": "#994F88"
    },
    {
      "hex": "#882E72"
    },
    {
      "hex": "#1965B0"
    },
    {
      "hex": "#437DBF"
    },
    {
      "hex": "#5289C7"
    },
    {
      "hex": "#6195CF"
    },
    {
      "hex": "#7BAFDE"
    },
    {
      "hex": "#4EB265"
    },
    {
      "hex": "#90C987"
    },
    {
      "hex": "#CAE0AB"
    },
    {
      "hex": "#F7F056"
    },
    {
      "hex": "#F7CB45"
    },
    {
      "hex": "#F6C141"
    },
    {
      "hex": "#F4A736"
    },
    {
      "hex": "#F1932D"
    },
    {
      "hex": "#EE8026"
    },
    {
      "hex": "#E8601C"
    },
    {
      "hex": "#E65518"
    },
    {
      "hex": "#DC050C"
    },
    {
      "hex": "#A5170E"
    },
    {
      "hex": "#72190E"
    },
    {
      "hex": "#42150A"
    }
  ],
  "bad": "#FFFFFF",
  "interpolation": "none",
  "lut": [
    [
      9
    ],
    [
      9,
      25
    ],
    [
      9,
      17,
      25
    ],
    [
      9,
      14,
      17,
      25
    ],
    [
      9,
      13,
      14,
      17,
      25
    ],
    [
      9,
      13,
      14,
      16,
      17,
      25
    ],
    [
      8,
      9,
      13,
      14,
      16,
      17,
      25
    ],
    [
      8,
      9,
      13,
      14,
      16,
      17,
      22,
      25
    ],
    [
      8,
      9,
      13,
      14,
      16,
      17,
      22,
      25,
      27
    ],
    [
      8,
      9,
      13,
      14,
      16,
      17,
      20,
      23,
      25,
      27
    ],
    [
      8,
      9,
      11,
      13,
      14,
      16,
      17,
      20,
      23,
      25,
      27
    ],
    [
      2,
      5,
      8,
      9,
      11,
      13,
      14,
      16,
      17,
      20,
      23,
      25
    ],
    [
      2,
      5,
      8,
      9,
      11,
      13,
      14,
      15,
      16,
      17,
      20,
      23,
      25
    ],
    [
      2,
      5,
      8,
      9,
      11,
      13,
      14,
      15,
      16,
      17,
      19,
      21,
      23,
      25
    ],
    [
      2,
      5,
      8,
      9,
      11,
      13,
      14,
      15,
      16,
      17,
      19,
      21,
      23,
      25,
      27
    ],
    [
      2,
      4,
      6,
      8,
      9,
      11,
      13,
      14,
      15,
      16,
      17,
      19,
      21,
      23,
      25,
      27
    ],
    [
      2,
      4,
      6,
      7,
      8,
      9,
      11,
      13,
      14,
      15,
      16,
      17,
      19,
      21,
      23,
      25,
      27
    ],
    [
      2,
      4,
      6,
      7,
      8,
      9,
      11,
      13,
      14,
      15,
      16,
      17,
      19,
      21,
      23,
      25,
      26,
      27
    ],
    [
      1,
      3,
      4,
      6,
      7,
      8,
      9,
      11,
      13,
      14,
      15,
      16,
      17,
      19,
      21,
      23,
      25,
      26,
      27
    ],
    [
      1,
      3,
      4,
      6,
      7,
      8,
      9,
      10,
      12,
      13,
      14,
      15,
      16,
      17,
      19,
      21,
      23,
      25,
      26,
      27
    ],
    [
      1,
      3,
      4,
      6,
      7,
      8,
      9,
      10,
      12,
      13,
      14,
      15,
      16,
      17,
      18,
      20,
      22,
      24,
      25,
      26,
      27
    ],
    [
      1,
      3,
      4,
      6,
      7,
      8,
      9,
      10,
      12,
      13,
      14,
      15,
      16,
      17,
      18,
      20,
      22,
      24,
      25,
      26,
      27,
      28
    ],
    [
      0,
      1,
      3,
      4,
      6,
      7,
      8,
      9,
      10,
      12,
      13,
      14,
      15,
      16,
      17,
      18,
      20,
      22,
      24,
      25,
      26,
      27,
      28
    ]
  ],
  "lutBad": {
    "23": "#777777"
  },
  "source": {
    "retrieved": "2026-10-18",
    "siteFigure": "fig:scheme_rainbow_discrete",
    "siteUrl": "https://sronpersonalpages.nl/~pault/#fig:scheme_rainbow_discrete",
    "module": "tol_cmap('rainbow_discrete', lut)",
    "moduleName": "rainbow_discrete",
    "moduleVersion": "2022.10"
  }
}
